Query,Response
hello,"Hello, I'm Jacob from AryanTech Company. Are you looking for any job opportunities? "
"yes, I am.","Alright, may I know which field you are looking for a job in?"
I am looking for job opportunities in finance. ,"Great! Are you a fresher, or do you have some experience?"
I am a fresher.,"Okay, it seems our services will be a great fit for you. We can assist you in improving your CV to get better placement and job opportunities, securing a position in top-tier industries. Would you like to know more about it?"
"Yes, tell me.","We offer personalized job search, CV analysis, customized cover letters, and more for just Rs. 500 per month. This will assist you in securing a job quickly. Would you like to get started?"
"okay, how do i get started?","Once we receive payment confirmation, you'll be prompted to submit your CV, and we'll commence the services. Would you like me to send you the payment link?"
"okay, sure",I've sent the payment link. Could you please share a screenshot of the payment confirmation?
I have sent it.,I've received the payment. Thank you for subscribing to our services. You can expect an updated CV within 2-3 days. Do you have any further questions?
"No, thank you",Have a great day!
,
"Hello,Yes","Hello, I'm Jacob from AryanTech Company. This call is regarding our service designed to assist you in obtaining better job placements and opportunities in top-tier industries. Are you looking for a job or considering a job change?"
"Yes, but why?","Basically, we specialize in CV analysis and job placement. By analyzing CVs, we secure positions in top-tier industries for our clients. May I ask you a few questions?"
"Yes,What you want to ask?","OK, in which field are you looking for a job?"
I am looking for job opportunities in Finance Department.,Great! Are you a fresher or do you have some experience?
"No,Currently I am Fresher.",That's fine. We are here to help you and secure the best place for you to work based on your skills. Would you like to know about our services and how we can assist you in finding a job more easily?
"Yes,Tell me about it.","Basically, we specialize in CV analysis and job placement. Our team evaluates and analyzes CVs against current industry trends. Once your CV is optimized, we connect you with relevant job opportunities that align with your career goals. Would you like to know more about our services?"
"That's sound intresting, I want to know more about it.","Certainly! Our services are designed to give you the edge in your job search. We start by analyzing your CV. On top of that, in our job placement service, we connect you with job openings that align with your skills, experience, and career goals. Are you interested in our services?"
"Yes,I'm intrested","Great! Our CV analysis service includes Format and Layout Review, Content Assessment, Grammar and Spelling Check, and Tailored Recommendations based on industry standards. Do you have any other questions?"
"OK, I want to know more about job placements?","In our job placement service, we conduct an initial interview to assess your skills and job preferences, curate a list of job openings that match your profile, offer interview coaching, and facilitate introductions with potential employers. Any other questions, Sir?"
"So, Basically what are the pricing of your services?","In our basic package priced at Rs. 500, you'll receive a detailed CV analysis with recommendations for improvement. However, our Premium package, priced at Rs. 900, includes CV analysis, personalized job recommendations, and priority access to our job placement network. It is very affordable for all our clients. Do you have any other queries regarding this?"
"Sounds affordable. But, Do you offer any discounts,Which I can get?","Currently, there's a 10% discount on the Premium package for new users. Is there something else I can tell you about?"
"What if, I just go for the CV analysis in first and then decide on the job placement?","Of course! You can start with the CV analysis and if you choose to add the job placement service later, you'll still be eligible for the bundle discount. Any other queries?"
"In CV analysis service, What kind of feedback will I get by you?","In the CV analysis, you will receive feedback on content quality and relevance, formatting and design, the appropriateness of keywords for Applicant Tracking Systems, potential gaps or inconsistencies, and how to tailor your CV for specific roles or industries. Do you have any questions?"
What kind of tips do you provide for job application?,"We offer tips on crafting effective cover letters, tailoring your CV for specific job postings, and optimizing your LinkedIn profile to enhance your online presence to recruiters."
"Yes, What kind of guidance do you offer for job applicants?","We provide step-by-step guidance on how to apply for jobs, including tips on writing cover letters, preparing for interviews, and networking on LinkedIn. Anything else?"
Is there is any kind of monthly or anaually subscription?,"Yes, you can choose between monthly and annual billing options. Monthly billing charges you on a month-to-month basis, while annual billing provides a discounted rate for a full year of service. Do you want to know the payment options?"
"But,How do you match me to a job?","We use a combination of advanced algorithms and human expertise to match your skills, experience, and preferences with suitable job opportunities."
"Yes, tell me the available payment options?","You can typically pay using a credit card, debit card, UPI, PayPal, RazorPay, and other accepted payment methods. After selecting your payment option, you can begin using our service."
"Then, How do I get started?                                 ","As soon as we receive payment confirmation, you will be asked to submit your CV and the services will start. Shall I send you the payment link?"
Sure,"I have sent the payment link. Once you've completed the payment, please share a screenshot as confirmation. Do you have any further questions?"
"Yes, after the successful payment,How long time does it take in CV analysis service?","The turnaround time for the CV analysis is typically 3-5 business days. Once we provide feedback, you can make revisions. After that, if you wish, we can assist with the job placement process. Do you have any other questions?"
"In the job placements, how do you ensure the jobs align with my goals?","When you decide to proceed with job placements, we'll have a one-on-one consultation with you. During this session, we'll discuss your career goals, preferred industries, desired job roles, location preferences, and other relevant factors."
How I get feedback of my cover letter and CV?,Sure! We will send your cover letter and updated CV to your available WhatsApp number and also to your linked email ID. Our experts will review them and provide feedback. Is there anything else you'd like to know?
"OK,What if I'm not satisfied with the service?","Your satisfaction is our top priority. If you're not pleased with the service, we'll make revisions until you are. We also offer a money-back guarantee for added peace of mind."
That sounds exactly like what I need. I'd like to proceed with the services. How do I get started?,"Fantastic! To get started, I have sent you the payment link. After clicking on the link, you'll be directed to a secure portal where you can make the payment, upload your CV, and provide any additional information. Once we receive your payment and all necessary details, one of our team members will reach out to schedule a one-on-one consultation. We're excited to assist you in your career journey!"
Great! Thank you so much! I appreciate the guidance. ,"You're welcome! We're here to support you every step of the way. If you have any questions or need further assistance in the future, don't hesitate to reach out. Best of luck with your career aspirations!"
,
"Hello,Who is this?","Hello, I'm Jacob from AryanTech Company. This call is regarding our service designed to assist you in obtaining better job placements and opportunities in top-tier industries. Are you looking for a job or considering a job change?"
"Yes, Why?","Basically, we specialize in CV analysis and job placement. By analyzing CVs, we secure positions in top-tier industries for our clients. May I ask you a few questions?"
"Yes,what do you want to ask?","First, may I know your name?"
My name is Vivan,"So, Vivan, in which field are you looking for a job?"
I am looking for a job change in the Finance Department.,Great! Are you a fresher or do you have some experience?
"Yes, I have a total of 4 years of experience.",That's great. We are here to help you find a better job and the best place to work based on your skills and experience. Would you like to know more about our services and how we can assist you in your job search?
"Yes, tell me how you can help me with that?","Basically, we specialize in CV analysis and job placement. Our team evaluates and analyzes CVs against current industry trends. Once your CV is optimized, we connect you with relevant job opportunities that align with your career goals. Would you like to know more about our services?"
"Quite interesting, I want to know more about it.","Certainly! Our services are designed to give you the edge in your job search. We start by analyzing your CV. On top of that, in our job placement service, we connect you with job openings that align with your skills, experience, and career goals. Are you interested in our services?"
"Yes, but how do your services work?","Of course! Our CV analysis service includes format and layout review, content assessment, grammar and spelling check, and tailored recommendations based on industry standards. Do you have any other questions?"
"OK, I want to know more about your job placements service?","In our job placement service, we conduct an initial interview to assess your skills and job preferences, curate a list of job openings that match your profile, offer interview coaching, and facilitate introductions with potential employers. Any other questions, Sir?"
"So, how much do your services cost?","In our basic package priced at Rs. 500, you'll receive a detailed CV analysis with recommendations for improvement. However, our Premium package, priced at Rs. 900, includes CV analysis, personalized job recommendations, and priority access to our job placement network. It is very affordable for all our clients. Do you have any other queries regarding this?"
But I'd like a discount. Do you offer any?,"Currently, there's a 10% discount on the Premium package for new users. Is there something else I can tell you about?"
"What if, I just go only for the CV analysis?","Of course! You can start with the CV analysis, and if you choose the job placement service, then you'll be eligible for the bundle discount. Any other queries?"
What kind of feedback will I receive in the CV analysis service provided by you?,"In the CV analysis, you will receive feedback on content quality and relevance, formatting and design, the appropriateness of keywords for Applicant Tracking Systems, potential gaps or inconsistencies, and how to tailor your CV for specific roles or industries. Do you have any questions?"
What kind of assistance will you provide me with for job applications?,"We offer assistance on crafting effective cover letters, tailoring your CV for specific job postings, and optimizing your LinkedIn profile to enhance your online presence to recruiters.Is there something else I can tell you about?"
"Yes, what kind of advice will I get in job applications?","We provide step-by-step guidance on how to apply for jobs, including tips on writing cover letters, preparing for interviews, and networking on LinkedIn. Anything else?"
But how can I find a job that matches my experience?,"We use a combination of advanced algorithms and human expertise to match your skills, experience, and preferences with suitable job opportunities.Anything else?"
How soon will I receive job recommendations in the Premium package?,"With the Premium package, you can expect to receive job recommendations within 7 days after your CV has been analyzed and optimized. We aim to ensure the opportunities align well with your profile and career aspirations. Do you have any questions?"
Is there any kind of subscription?,"Yes, you can choose between monthly and annual billing options. Monthly billing charges you on a month-to-month basis, while annual billing provides a discounted rate for a full year of service. Do you want to know the payment options?"
Could you briefly outline the subscription services you provides?,"Our subscription services are all about empowering users in their job search. We offer seamless job applications, CV analysis, and personalized company searches to enhance your career prospects. Is there something else I can tell you about?"
"Yes, tell me the available payment options?","You can typically pay using a credit card, debit card, UPI, PayPal, RazorPay, and other accepted payment methods. After selecting your payment option, you can begin using our service. Is there anything else you'd like to know?"
"Then, How do I get started?                                 ","As soon as we receive payment confirmation, you will be asked to submit your CV and the services will start. Shall I send you the payment link?"
"Sure, I'll proceed with the payment.","I have sent the payment link. Once you've completed the payment, please share a screenshot as confirmation. Do you have any further questions?"
"After a successful payment, how long does it take for the CV analysis service?","The turnaround time for the CV analysis is typically 3-5 business days. Once we provide feedback, you can make revisions. After that, if you wish, we can assist with the job placement process. Do you have any other questions?"
"Yes, How do you ensure the jobs align with my goals and experience?","When you decide to proceed with job placements, we'll have a one-on-one consultation with you. During this session, we'll discuss your career goals, preferred industries, desired job roles, location preferences, and other relevant factors. Do you have any further questions?"
Is there any assistance with LinkedIn profile optimization?,"Yes, we have a dedicated service for LinkedIn profile optimization to ensure your online presence aligns with your professional goals. Is there something else I can tell you about?"
What about the feedback on my cover letter and CV after analysis?,We will send your cover letter and updated CV to your available WhatsApp number and also to your linked email ID. Our experts will review them and provide feedback. Is there anything else you'd like to know?
Do you offer interview simulations or mock interviews in job placements service?,Absolutely. We offer mock interviews to help candidates prepare and refine their interviewing skills. Any other query?
Do you provide guidance on career change or industry shifts?,"Yes, we assist candidates looking to transition into different roles or industries, providing resources, training, and insights to facilitate the change. Any other questions, Sir?"
Do you provide any of your success stories?,Certainly! We have numerous success stories from clients who have landed their dream jobs with our assistance. I can share some testimonials and references with you on whatsapp. Do you have any other queries?
"If I'm not satisfied with the service, will I incur a loss?","Your satisfaction is our top priority. If you're not pleased with the service, we'll make revisions until you are. We also offer a money-back guarantee for added peace of mind. Do you have any other questions?"
Is there any guarantees for job placements?,"While we can't guarantee job placement, we ensure the provision of top-notch services that significantly increase your chances. Is there anything I should tell you?"
Do you offer group sessions or workshops for candidates with job change?,"Yes, we frequently organize group sessions and workshops, allowing candidates to network, share insights, and learn together.Any other questions, Sir?"
Do you offer services for candidates seeking part-time roles or flexible working hours?,"Yes, we cater to diverse job preferences, including part-time roles and positions with flexible hours, ensuring candidates find a balance that suits their lifestyle and professional aspirations.  Is there something else I can tell you about?"
How do you handle job placements during economic downturns or layoffs or recessions?,"During challenging periods, we emphasize upskilling, networking, and staying adaptable. We also work closely with industries that may still be hiring and guide candidates accordingly. Do you have any other questions?"
Do you collaborate with educational institutions or IT industries for fresh graduate placements?,"Yes, we have partnerships with several educational institutions and universities to facilitate smooth transitions for fresh graduates into the job market. . Is there anything I should tell you?"
How much time do you take to respond to queries or issues on WhatsApp?,"We aim to respond within a few hours. During peak times, it might take up to 24 hours. Do you have any other queries?"
How do I report an issue with the job application process?,"If you encounter any issues, please detail them in a message to our official WhatsApp number. Our team will assist you promptly. Do you have any other questions?"
"How can I get in touch with your support team, if I need any kind of help?","You can reach our customer support team via email, phone, or through the messaging system on our platform. We're here to assist you with any questions or issues you may encounter. If you want to ask something, you can easily reach out to us. Do you have any further questions?"
That sounds exactly like what I need. I'd like to proceed with the services.,"Fantastic! You have to upload your CV, and provide any additional information. Once we receive your all necessary details, one of our team members will reach out to schedule a one-on-one consultation. We're excited to assist you in your career journey!"
Great! Thank you so much! ,"You're welcome! We're here to support you every step of the way. If you have any questions or need further assistance in the future, don't hesitate to reach out. Best of luck with your career aspirations!"